{
  "$schema": "https://json-schema.org/draft/2020-12/schema",
  "$id": "https://omarchy-flish.dev/schema/hint.schema.json",
  "title": "Omarchy Flish hint template",
  "description": "One parameterized Socratic hint, written and approved by a person. Never generated at runtime.",
  "type": "object",
  "required": [
    "schema_version",
    "id",
    "match",
    "title",
    "body"
  ],
  "additionalProperties": false,
  "properties": {
    "schema_version": {
      "const": 1
    },
    "id": {
      "type": "string",
      "pattern": "^[a-z0-9]+(-[a-z0-9]+)*$",
      "description": "Stable, human-readable. Telemetry references it, so it is never reused for different copy."
    },
    "match": {
      "type": "object",
      "description": "All present conditions must hold. An absent condition is not checked.",
      "additionalProperties": false,
      "properties": {
        "command": {
          "type": "string",
          "description": "Exact verb, e.g. 'cd'."
        },
        "status": {
          "type": "string",
          "enum": [
            "Not_Found",
            "Not_A_Directory",
            "Is_A_Directory",
            "Unknown_Command",
            "Bad_Usage"
          ]
        },
        "stderr": {
          "type": "string",
          "description": "Regex over the authentic error line."
        }
      }
    },
    "requires": {
      "type": "object",
      "description": "VFS state decorators. These are what separate two failures that print the same error but teach different lessons.",
      "additionalProperties": false,
      "properties": {
        "target_exists": {
          "type": "boolean"
        },
        "target_is_file": {
          "type": "boolean"
        },
        "cwd_has_children": {
          "type": "boolean"
        },
        "cwd_has_files": {
          "type": "boolean",
          "description": "The directory the child is standing in holds at least one file. What makes \"which file did you mean to read?\" a true question -- it is false in a directory of nothing but folders."
        },
        "cwd_has_dirs": {
          "type": "boolean",
          "description": "The directory the child is standing in holds at least one folder. The mirror of cwd_has_files, and what \"which folder did you mean to enter?\" depends on."
        },
        "target_near_sibling": {
          "type": "boolean",
          "description": "A sibling name is within edit distance 2 of what was typed. The typo case, and the one most worth separating from a plain miss."
        },
        "target_in_parent": {
          "type": "boolean",
          "description": "The name that was not found here exists one level up. The wrong-room case."
        },
        "cwd_is_root": {
          "type": "boolean",
          "description": "The child is at the top of the tree, so there is no further up to go."
        },
        "target_is_empty_dir": {
          "type": "boolean",
          "description": "The target is a directory with nothing in it."
        },
        "argv_count": {
          "type": "integer",
          "minimum": 0,
          "description": "Exact argument count. Separates 'you gave none' from 'you gave three', which are different lessons at the same status."
        },
        "near_sibling_is_dir": {
          "type": "boolean",
          "description": "The near-miss sibling is a directory rather than a file. Splits the typo lesson by type: almost-typing a folder name means the next step is to walk into it, not to fix the spelling and retry the same command."
        }
      }
    },
    "min_strike": {
      "type": "integer",
      "minimum": 1,
      "default": 3,
      "description": "Consecutive same-signature failures before this may fire. The engine fires the most specific matching template whose min_strike is met, so a higher value is how a second, blunter hint is held back until the first has not worked."
    },
    "title": {
      "type": "string",
      "maxLength": 60
    },
    "body": {
      "type": "string",
      "maxLength": 240,
      "description": "Socratic. Must ask, never instruct. Must NOT contain a runnable command line -- the child types the answer, the tutor does not supply it. Supports {{target}}, the name the child typed, and {{near}}, the name they almost typed -- {{near}} only on a template that requires target_near_sibling, since nothing else guarantees such a name exists."
    },
    "ttl_ms": {
      "type": "integer",
      "minimum": 0,
      "default": 12000,
      "description": "Auto-dismiss delay. 0 means stay until dismissed."
    }
  }
}
